[
  {
    "schema_version": "1.0",
    "event_type": "fall_suspected",
    "window_id": "trial-01:7",
    "detected_at": "2026-08-05T10:30:00+09:00",
    "room_id": "living-room",
    "risk_score": 0.9,
    "evidence": {
      "motion_label": "fall_like",
      "motion_confidence": 0.91,
      "presence_state": "present",
      "presence_probability": 0.95,
      "no_recovery_sec": 4.0
    }
  },
  {
    "schema_version": "1.0",
    "event_type": "fall_suspected",
    "window_id": "trial-01:3",
    "detected_at": "2026-08-05T08:12:30+09:00",
    "room_id": "bathroom",
    "risk_score": 0.72,
    "evidence": {
      "motion_label": "fall_like",
      "motion_confidence": 0.68,
      "presence_state": "unknown",
      "presence_probability": 0.41
    }
  },
  {
    "schema_version": "1.0",
    "event_type": "fall_suspected",
    "window_id": "trial-00:19",
    "detected_at": "2026-08-04T21:05:10+09:00",
    "room_id": "bedroom",
    "risk_score": 0.55,
    "evidence": {
      "motion_label": "sudden_drop",
      "motion_confidence": 0.57,
      "presence_state": "present",
      "presence_probability": 0.88,
      "no_recovery_sec": 1.5
    }
  },
  {
    "schema_version": "1.0",
    "event_type": "fall_suspected",
    "window_id": "trial-00:11",
    "detected_at": "2026-08-04T14:47:00+09:00",
    "room_id": "kitchen",
    "risk_score": 0.83,
    "evidence": {
      "motion_label": "fall_like",
      "motion_confidence": 0.79,
      "presence_state": "absent",
      "presence_probability": 0.12,
      "no_recovery_sec": 9.0
    }
  }
]
